{
  "$schema": "../schemas/security-remediation.schema.json",
  "identity": {
    "informationUuidV5": "635084d9-008d-5c4a-a521-89614026e586",
    "observationUuidV7": "01a04cdc-3b33-770e-a586-a0de4a275d5d",
    "namespace": "47f3e535-0e27-559a-9556-aa79a84f95eb",
    "observedAt": "2026-08-29T09:31:36.627Z"
  },
  "stateTransition": {
    "from": "CODE_SCANNING_UNMEASURED",
    "through": ["DEFAULT_SETUP_CONFIGURED", "INITIAL_ANALYSIS_COMPLETED", "THIRTEEN_ALERTS_ISSUE_TRACKED", "LOCAL_PATCH_VALIDATED", "TWO_AUDIT_SCOPES_ZERO"],
    "to": "LOCAL_PATCH_VALIDATED_AWAITING_GITHUB_RESCAN",
    "eventId": "01a04cdc-3b33-770e-a586-a0de4a275d5d",
    "occurredAt": "2026-08-29T09:31:36.627Z",
    "machineContract": "Every CodeQL alert maps to exactly one public issue and one reviewed local repair category. Local tests and two zero-result npm audit observations do not close an alert: closure requires a later main-branch CodeQL analysis and official GitHub state readback."
  },
  "codeql": {
    "configuration": {
      "state": "configured",
      "apiLanguageTokens": ["actions", "javascript", "javascript-typescript", "python", "typescript"],
      "normalizedAnalysisLanguages": ["actions", "javascript-typescript", "python"],
      "querySuite": "extended",
      "threatModel": "remote_and_local",
      "runnerType": "standard",
      "runnerLabel": "",
      "scanSchedule": null,
      "scanScheduleState": "PROVIDER_DEFAULT_NOT_EXPLICIT_IN_API"
    },
    "initialAnalysis": {
      "informationUuidV5": "2e2ab483-f3f3-5a31-af2d-be1459b52e85",
      "observationUuidV7": "01a04cc2-05b8-71bb-81bb-bed308926a82",
      "observedAt": "2026-08-29T09:02:59.000Z",
      "runId": 33244513119,
      "runUrl": "https://github.com/Anionix/verifiable-offline-webmcp-agent-spec/actions/runs/33244513119",
      "name": "CodeQL Setup",
      "event": "dynamic",
      "ref": "refs/heads/main",
      "commit": "586b566d96eff4762a91a0db488bb83b781ae591",
      "status": "completed",
      "conclusion": "success",
      "createdAt": "2026-08-29T09:01:45.000Z",
      "startedAt": "2026-08-29T09:01:45.000Z",
      "updatedAt": "2026-08-29T09:02:59.000Z",
      "analyses": [
        {
          "analysisId": 1691323205,
          "category": "/language:actions",
          "createdAt": "2026-08-29T09:02:18.000Z",
          "results": 0,
          "rules": 23,
          "tool": "CodeQL",
          "toolVersion": "2.26.4"
        },
        {
          "analysisId": 1691323562,
          "category": "/language:python",
          "createdAt": "2026-08-29T09:02:32.000Z",
          "results": 0,
          "rules": 50,
          "tool": "CodeQL",
          "toolVersion": "2.26.4"
        },
        {
          "analysisId": 1691323967,
          "category": "/language:javascript-typescript",
          "createdAt": "2026-08-29T09:02:47.000Z",
          "results": 13,
          "rules": 103,
          "tool": "CodeQL",
          "toolVersion": "2.26.4"
        }
      ]
    },
    "alerts": [
      {
        "alert": 1,
        "issue": 91,
        "rule": "js/regex-injection",
        "severity": "HIGH",
        "path": "scripts/validate_void_integration.mjs",
        "line": 102,
        "codeScanningAlertUuidV5": "36fd7057-077a-5ee7-85b7-689b9fad63c0",
        "observationUuidV7": "01a04cd2-7fd0-764c-95a9-71cf516a7846",
        "observedAt": "2026-08-29T09:20:58.920Z",
        "fixCategory": "FIXED_SCHEMA_PATTERN_ALLOWLIST",
        "state": "LOCAL_PATCH_VALIDATED_AWAITING_GITHUB_RESCAN"
      },
      {
        "alert": 2,
        "issue": 92,
        "rule": "js/regex-injection",
        "severity": "HIGH",
        "path": "scripts/validate_service_integrations.mjs",
        "line": 360,
        "codeScanningAlertUuidV5": "319859e9-0dff-5d5d-94ac-86e0d9e210a1",
        "observationUuidV7": "01a04cd2-7fd0-764c-95a9-71d0301a2bda",
        "observedAt": "2026-08-29T09:20:59.990Z",
        "fixCategory": "FIXED_SCHEMA_PATTERN_ALLOWLIST",
        "state": "LOCAL_PATCH_VALIDATED_AWAITING_GITHUB_RESCAN"
      },
      {
        "alert": 3,
        "issue": 93,
        "rule": "js/command-line-injection",
        "severity": "CRITICAL",
        "path": "scripts/validate_void_integration.mjs",
        "line": 338,
        "codeScanningAlertUuidV5": "c183f0bb-4dd7-55c3-ab77-1623097ed401",
        "observationUuidV7": "01a04cd2-7fd0-764c-95a9-71d1e1115af1",
        "observedAt": "2026-08-29T09:21:01.069Z",
        "fixCategory": "FIXED_EXECUTABLE_ARGUMENT_BOUNDARY",
        "state": "LOCAL_PATCH_VALIDATED_AWAITING_GITHUB_RESCAN"
      },
      {
        "alert": 4,
        "issue": 94,
        "rule": "js/path-injection",
        "severity": "HIGH",
        "path": "src/typescript/notification/audit-log.ts",
        "line": 31,
        "codeScanningAlertUuidV5": "bb8a27d6-b006-5943-bb8e-259944451de1",
        "observationUuidV7": "01a04cd2-7fd0-764c-95a9-71d2a1abe2bf",
        "observedAt": "2026-08-29T09:21:02.149Z",
        "fixCategory": "AUDIT_LOG_CONTAINED_NOFOLLOW_IO",
        "state": "LOCAL_PATCH_VALIDATED_AWAITING_GITHUB_RESCAN"
      },
      {
        "alert": 5,
        "issue": 95,
        "rule": "js/path-injection",
        "severity": "HIGH",
        "path": "src/typescript/notification/audit-log.ts",
        "line": 32,
        "codeScanningAlertUuidV5": "4afc5ee0-5722-5874-9bd3-f4e77c6bdd85",
        "observationUuidV7": "01a04cd2-7fd0-764c-95a9-71d3c5dccdaa",
        "observedAt": "2026-08-29T09:21:03.473Z",
        "fixCategory": "AUDIT_LOG_CONTAINED_NOFOLLOW_IO",
        "state": "LOCAL_PATCH_VALIDATED_AWAITING_GITHUB_RESCAN"
      },
      {
        "alert": 6,
        "issue": 96,
        "rule": "js/path-injection",
        "severity": "HIGH",
        "path": "src/typescript/notification/audit-log.ts",
        "line": 37,
        "codeScanningAlertUuidV5": "50aa665e-6eb3-50be-a14a-018f179aac95",
        "observationUuidV7": "01a04cd2-7fd0-764c-95a9-71d4b755b26f",
        "observedAt": "2026-08-29T09:21:04.555Z",
        "fixCategory": "AUDIT_LOG_CONTAINED_NOFOLLOW_IO",
        "state": "LOCAL_PATCH_VALIDATED_AWAITING_GITHUB_RESCAN"
      },
      {
        "alert": 7,
        "issue": 97,
        "rule": "js/path-injection",
        "severity": "HIGH",
        "path": "src/typescript/notification/audit-log.ts",
        "line": 40,
        "codeScanningAlertUuidV5": "f6e4f0a9-4e95-567b-b8c6-0ddcfb93c417",
        "observationUuidV7": "01a04cd2-7fd0-764c-95a9-71d569f59399",
        "observedAt": "2026-08-29T09:21:05.542Z",
        "fixCategory": "AUDIT_LOG_CONTAINED_NOFOLLOW_IO",
        "state": "LOCAL_PATCH_VALIDATED_AWAITING_GITHUB_RESCAN"
      },
      {
        "alert": 8,
        "issue": 98,
        "rule": "js/path-injection",
        "severity": "HIGH",
        "path": "src/typescript/notification/audit-log.ts",
        "line": 56,
        "codeScanningAlertUuidV5": "f906b2ac-9a95-5827-9825-06315f3c98ca",
        "observationUuidV7": "01a04cd2-7fd0-764c-95a9-71d68a71a6ea",
        "observedAt": "2026-08-29T09:21:06.505Z",
        "fixCategory": "AUDIT_LOG_CONTAINED_NOFOLLOW_IO",
        "state": "LOCAL_PATCH_VALIDATED_AWAITING_GITHUB_RESCAN"
      },
      {
        "alert": 9,
        "issue": 99,
        "rule": "js/path-injection",
        "severity": "HIGH",
        "path": "src/typescript/notification/audit-log.ts",
        "line": 57,
        "codeScanningAlertUuidV5": "85d7dbce-6bc8-59bb-92d9-efbb62b9a1a2",
        "observationUuidV7": "01a04cd2-7fd0-764c-95a9-71d7d6a0682e",
        "observedAt": "2026-08-29T09:21:07.529Z",
        "fixCategory": "AUDIT_LOG_CONTAINED_NOFOLLOW_IO",
        "state": "LOCAL_PATCH_VALIDATED_AWAITING_GITHUB_RESCAN"
      },
      {
        "alert": 10,
        "issue": 100,
        "rule": "js/path-injection",
        "severity": "HIGH",
        "path": "src/typescript/notification/store.ts",
        "line": 81,
        "codeScanningAlertUuidV5": "f8d08625-ae85-5e58-860f-6d1877e0a634",
        "observationUuidV7": "01a04cd2-7fd0-764c-95a9-71d8b4cdd17a",
        "observedAt": "2026-08-29T09:21:08.896Z",
        "fixCategory": "SQLITE_CONTAINED_PRIVATE_PATH",
        "state": "LOCAL_PATCH_VALIDATED_AWAITING_GITHUB_RESCAN"
      },
      {
        "alert": 11,
        "issue": 101,
        "rule": "js/weak-cryptographic-algorithm",
        "severity": "HIGH",
        "path": "scripts/validate_service_integrations.mjs",
        "line": 410,
        "codeScanningAlertUuidV5": "b383496a-7da8-5182-814d-3ddbe242e277",
        "observationUuidV7": "01a04cd2-7fd0-764c-95a9-71d94d6a6289",
        "observedAt": "2026-08-29T09:21:09.903Z",
        "fixCategory": "FIXED_UUID_V5_IDENTITY_LEDGER",
        "state": "LOCAL_PATCH_VALIDATED_AWAITING_GITHUB_RESCAN"
      },
      {
        "alert": 12,
        "issue": 102,
        "rule": "js/weak-cryptographic-algorithm",
        "severity": "HIGH",
        "path": "src/typescript/uuid.ts",
        "line": 21,
        "codeScanningAlertUuidV5": "539b6392-7e46-5d0f-a0aa-68d1e9c8696c",
        "observationUuidV7": "01a04cd2-7fd0-764c-95a9-71da06442f13",
        "observedAt": "2026-08-29T09:21:10.972Z",
        "fixCategory": "STANDARD_UUID_V5_LIBRARY_BOUNDARY",
        "state": "LOCAL_PATCH_VALIDATED_AWAITING_GITHUB_RESCAN"
      },
      {
        "alert": 13,
        "issue": 103,
        "rule": "js/remote-property-injection",
        "severity": "HIGH",
        "path": "src/typescript/test/evaluator.test.ts",
        "line": 39,
        "codeScanningAlertUuidV5": "5533f41d-695d-55b9-8978-924a7fb6fe2a",
        "observationUuidV7": "01a04cd2-7fd0-764c-95a9-71db5246131d",
        "observedAt": "2026-08-29T09:21:12.004Z",
        "fixCategory": "FIXED_GATE_ASSIGNMENT_CASES",
        "state": "LOCAL_PATCH_VALIDATED_AWAITING_GITHUB_RESCAN"
      }
    ],
    "fixCategories": [
      { "category": "FIXED_SCHEMA_PATTERN_ALLOWLIST", "alerts": [1, 2] },
      { "category": "FIXED_EXECUTABLE_ARGUMENT_BOUNDARY", "alerts": [3] },